row_order,industry_name,naics_code,industry_name_norm,series_id,supersector_code,industry_code,data_type_code,seasonal,series_title,footnote_codes,begin_year,begin_period,end_year,end_period,display_level,matched,industry_code_8,parent_series_id,parent_rule,denominator_opt1,denominator_opt1_name,denominator_opt2,denominator_opt2_name,denominator_opt3,denominator_opt3_name,denominator_opt4,denominator_opt4_name,denominator_opt5,denominator_opt5_name
432,"Specialized freight (except used goods) trucking, long-distance",48423,specialized freight except used goods trucking long-distance,CES4348423001,43,43484230,1,S,"All employees, thousands, specialized freight (except used goods) trucking, long-distance, seasonally adjusted",I,1990,M01,2025,M12,6,True,43484230,CES4348400001,parent_3digit,CES4348400001,Truck transportation,CES4300000001,Transportation and warehousing,CES4000000001,"Trade, transportation, and utilities",CES0700000001,Service-providing,CES0500000001,Total private
433,Transit and ground passenger transportation,485,transit and ground passenger transportation,CES4348500001,43,43485000,1,S,"All employees, thousands, transit and ground passenger transportation, seasonally adjusted",,1990,M01,2026,M01,4,True,43485000,CES0500000001,top_level_to_total_private,CES0700000001,Service-providing,CES4300000001,Transportation and warehousing,CES4000000001,"Trade, transportation, and utilities",CES0700000001,Service-providing,CES0500000001,Total private
434,Taxi and limousine service,4853,taxi and limousine service,CES4348530001,43,43485300,1,S,"All employees, thousands, taxi and limousine service, seasonally adjusted",I,1990,M01,2025,M12,5,True,43485300,CES4348500001,parent_3digit,CES4348500001,Transit and ground passenger transportation,CES4300000001,Transportation and warehousing,CES4000000001,"Trade, transportation, and utilities",CES0700000001,Service-providing,CES0500000001,Total private
435,School and employee bus transportation,4854,school and employee bus transportation,CES4348540001,43,43485400,1,S,"All employees, thousands, school and employee bus transportation, seasonally adjusted",I,1972,M01,2025,M12,5,True,43485400,CES4348500001,parent_3digit,CES4348500001,Transit and ground passenger transportation,CES4300000001,Transportation and warehousing,CES4000000001,"Trade, transportation, and utilities",CES0700000001,Service-providing,CES0500000001,Total private
436,"Urban transit systems and interurban, rural, and charter bus transportation","4851,2,5",urban transit systems and interurban rural and charter bus transportation,CES4348550001,43,43485500,1,S,"All employees, thousands, urban transit systems and interurban, rural, and charter bus transportation, seasonally adjusted",I,1990,M01,2025,M12,5,True,43485500,CES4348500001,parent_3digit,CES4348500001,Transit and ground passenger transportation,CES4300000001,Transportation and warehousing,CES4000000001,"Trade, transportation, and utilities",CES0700000001,Service-providing,CES0500000001,Total private
437,Other transit and ground passenger transportation,4859,other transit and ground passenger transportation,CES4348590001,43,43485900,1,S,"All employees, thousands, other transit and ground passenger transportation, seasonally adjusted",I,1990,M01,2025,M12,5,True,43485900,CES4348500001,parent_3digit,CES4348500001,Transit and ground passenger transportation,CES4300000001,Transportation and warehousing,CES4000000001,"Trade, transportation, and utilities",CES0700000001,Service-providing,CES0500000001,Total private
438,Pipeline transportation,486,pipeline transportation,CES4348600001,43,43486000,1,S,"All employees, thousands, pipeline transportation, seasonally adjusted",,1990,M01,2026,M01,4,True,43486000,CES0500000001,top_level_to_total_private,CES0700000001,Service-providing,CES4300000001,Transportation and warehousing,CES4000000001,"Trade, transportation, and utilities",CES0700000001,Service-providing,CES0500000001,Total private
439,Scenic and sightseeing transportation,487,scenic and sightseeing transportation,CES4348700001,43,43487000,1,S,"All employees, thousands, scenic and sightseeing transportation, seasonally adjusted",,1990,M01,2026,M01,4,True,43487000,CES0500000001,top_level_to_total_private,CES0700000001,Service-providing,CES4300000001,Transportation and warehousing,CES4000000001,"Trade, transportation, and utilities",CES0700000001,Service-providing,CES0500000001,Total private
440,Support activities for transportation,488,support activities for transportation,CES4348800001,43,43488000,1,S,"All employees, thousands, support activities for transportation, seasonally adjusted",,1990,M01,2026,M01,4,True,43488000,CES0500000001,top_level_to_total_private,CES0700000001,Service-providing,CES4300000001,Transportation and warehousing,CES4000000001,"Trade, transportation, and utilities",CES0700000001,Service-providing,CES0500000001,Total private
441,Support activities for air transportation,4881,support activities for air transportation,CES4348810001,43,43488100,1,S,"All employees, thousands, support activities for air transportation, seasonally adjusted",I,1990,M01,2025,M12,5,True,43488100,CES4348800001,parent_3digit,CES4348800001,Support activities for transportation,CES4300000001,Transportation and warehousing,CES4000000001,"Trade, transportation, and utilities",CES0700000001,Service-providing,CES0500000001,Total private
442,Support activities for water transportation,4883,support activities for water transportation,CES4348830001,43,43488300,1,S,"All employees, thousands, support activities for water transportation, seasonally adjusted",I,1990,M01,2025,M12,5,True,43488300,CES4348800001,parent_3digit,CES4348800001,Support activities for transportation,CES4300000001,Transportation and warehousing,CES4000000001,"Trade, transportation, and utilities",CES0700000001,Service-providing,CES0500000001,Total private
443,Marine cargo handling,48832,marine cargo handling,CES4348832001,43,43488320,1,S,"All employees, thousands, marine cargo handling, seasonally adjusted",I,1990,M01,2025,M12,6,True,43488320,CES4348800001,parent_3digit,CES4348800001,Support activities for transportation,CES4300000001,Transportation and warehousing,CES4000000001,"Trade, transportation, and utilities",CES0700000001,Service-providing,CES0500000001,Total private
444,Support activities for road transportation,4884,support activities for road transportation,CES4348840001,43,43488400,1,S,"All employees, thousands, support activities for road transportation, seasonally adjusted",I,1990,M01,2025,M12,5,True,43488400,CES4348800001,parent_3digit,CES4348800001,Support activities for transportation,CES4300000001,Transportation and warehousing,CES4000000001,"Trade, transportation, and utilities",CES0700000001,Service-providing,CES0500000001,Total private
445,Freight transportation arrangement,4885,freight transportation arrangement,CES4348850001,43,43488500,1,S,"All employees, thousands, freight transportation arrangement, seasonally adjusted",I,1990,M01,2025,M12,5,True,43488500,CES4348800001,parent_3digit,CES4348800001,Support activities for transportation,CES4300000001,Transportation and warehousing,CES4000000001,"Trade, transportation, and utilities",CES0700000001,Service-providing,CES0500000001,Total private
446,"Other support activities for transportation, including rail","4882,9",other support activities for transportation including rail,CES4348890001,43,43488900,1,S,"All employees, thousands, other support activities for transportation, including rail, seasonally adjusted",I,1990,M01,2025,M12,5,True,43488900,CES4348800001,parent_3digit,CES4348800001,Support activities for transportation,CES4300000001,Transportation and warehousing,CES4000000001,"Trade, transportation, and utilities",CES0700000001,Service-providing,CES0500000001,Total private
447,Couriers and messengers,492,couriers and messengers,CES4349200001,43,43492000,1,S,"All employees, thousands, couriers and messengers, seasonally adjusted",,1990,M01,2026,M01,4,True,43492000,CES0500000001,top_level_to_total_private,CES0700000001,Service-providing,CES4300000001,Transportation and warehousing,CES4000000001,"Trade, transportation, and utilities",CES0700000001,Service-providing,CES0500000001,Total private
448,Couriers and express delivery services,4921,couriers and express delivery services,CES4349210001,43,43492100,1,S,"All employees, thousands, couriers and express delivery services, seasonally adjusted",I,1990,M01,2025,M12,5,True,43492100,CES4349200001,parent_3digit,CES4349200001,Couriers and messengers,CES4300000001,Transportation and warehousing,CES4000000001,"Trade, transportation, and utilities",CES0700000001,Service-providing,CES0500000001,Total private
449,Local messengers and delivery and private postal service,"49,111,221",local messengers and delivery and private postal service,CES4349220001,43,43492200,1,S,"All employees, thousands, local messengers and delivery and private postal service, seasonally adjusted",I,1990,M01,2025,M12,6,True,43492200,CES4349200001,parent_3digit,CES4349200001,Couriers and messengers,CES4300000001,Transportation and warehousing,CES4000000001,"Trade, transportation, and utilities",CES0700000001,Service-providing,CES0500000001,Total private
450,Warehousing and storage,493,warehousing and storage,CES4349300001,43,43493000,1,S,"All employees, thousands, warehousing and storage, seasonally adjusted",,1990,M01,2026,M01,4,True,43493000,CES0500000001,top_level_to_total_private,CES0700000001,Service-providing,CES4300000001,Transportation and warehousing,CES4000000001,"Trade, transportation, and utilities",CES0700000001,Service-providing,CES0500000001,Total private
451,General warehousing and storage,49311,general warehousing and storage,CES4349311001,43,43493110,1,S,"All employees, thousands, general warehousing and storage, seasonally adjusted",I,1990,M01,2025,M12,6,True,43493110,CES4349300001,parent_3digit,CES4349300001,Warehousing and storage,CES4300000001,Transportation and warehousing,CES4000000001,"Trade, transportation, and utilities",CES0700000001,Service-providing,CES0500000001,Total private
452,Refrigerated warehousing and storage,49312,refrigerated warehousing and storage,CES4349312001,43,43493120,1,S,"All employees, thousands, refrigerated warehousing and storage, seasonally adjusted",I,1990,M01,2025,M12,6,True,43493120,CES4349300001,parent_3digit,CES4349300001,Warehousing and storage,CES4300000001,Transportation and warehousing,CES4000000001,"Trade, transportation, and utilities",CES0700000001,Service-providing,CES0500000001,Total private
453,"Other warehousing and storage, including farm product","49313,9",other warehousing and storage including farm product,CES4349319001,43,43493190,1,S,"All employees, thousands, other warehousing and storage, including farm product, seasonally adjusted",I,1990,M01,2025,M12,6,True,43493190,CES4349300001,parent_3digit,CES4349300001,Warehousing and storage,CES4300000001,Transportation and warehousing,CES4000000001,"Trade, transportation, and utilities",CES0700000001,Service-providing,CES0500000001,Total private
454,Utilities,22,utilities,CES4422000001,44,44220000,1,S,"All employees, thousands, utilities, seasonally adjusted",,1964,M01,2026,M01,3,True,44220000,CES0500000001,top_level_to_total_private,CES0700000001,Service-providing,CES0700000001,Service-providing,CES4000000001,"Trade, transportation, and utilities",CES0700000001,Service-providing,CES0500000001,Total private
455,"Electric power generation, transmission and distribution",2211,electric power generation transmission and distribution,CES4422110001,44,44221100,1,S,"All employees, thousands, electric power generation, transmission and distribution, seasonally adjusted",I,1990,M01,2025,M12,5,True,44221100,CES4422000001,parent_2digit,CES4422000001,Utilities,CES4422000001,Utilities,CES4000000001,"Trade, transportation, and utilities",CES0700000001,Service-providing,CES0500000001,Total private
456,Electric power generation,22111,electric power generation,CES4422111001,44,44221110,1,S,"All employees, thousands, electric power generation, seasonally adjusted",I,1990,M01,2025,M12,6,True,44221110,CES4422110001,parent_4digit,CES4422000001,Utilities,CES4422000001,Utilities,CES4000000001,"Trade, transportation, and utilities",CES0700000001,Service-providing,CES0500000001,Total private
457,Fossil fuel electric power generation,221112,fossil fuel electric power generation,CES4422111201,44,44221112,1,S,"All employees, thousands, fossil fuel electric power generation, seasonally adjusted",I,1990,M01,2025,M12,7,True,44221112,CES4422110001,parent_4digit,CES4422000001,Utilities,CES4422000001,Utilities,CES4000000001,"Trade, transportation, and utilities",CES0700000001,Service-providing,CES0500000001,Total private
458,"Hydroelectric and nuclear, solar, wind, geothermal, biomass, and other electric power generation","221111,3-8",hydroelectric and nuclear solar wind geothermal biomass and other electric power generation,CES4422111801,44,44221118,1,S,"All employees, thousands, hydroelectric and nuclear, solar, wind, geothermal, biomass, and other electric power generation, seasonally adjusted",I,1990,M01,2025,M12,7,True,44221118,CES4422110001,parent_4digit,CES4422000001,Utilities,CES4422000001,Utilities,CES4000000001,"Trade, transportation, and utilities",CES0700000001,Service-providing,CES0500000001,Total private
459,"Electric power transmission, control, and distribution",22112,electric power transmission control and distribution,CES4422112001,44,44221120,1,S,"All employees, thousands, electric power transmission, control, and distribution, seasonally adjusted",I,1990,M01,2025,M12,6,True,44221120,CES4422110001,parent_4digit,CES4422000001,Utilities,CES4422000001,Utilities,CES4000000001,"Trade, transportation, and utilities",CES0700000001,Service-providing,CES0500000001,Total private
460,Electric bulk power transmission and control,221121,electric bulk power transmission and control,CES4422112101,44,44221121,1,S,"All employees, thousands, electric bulk power transmission and control, seasonally adjusted",I,1990,M01,2025,M12,7,True,44221121,CES4422110001,parent_4digit,CES4422000001,Utilities,CES4422000001,Utilities,CES4000000001,"Trade, transportation, and utilities",CES0700000001,Service-providing,CES0500000001,Total private
461,Electric power distribution,221122,electric power distribution,CES4422112201,44,44221122,1,S,"All employees, thousands, electric power distribution, seasonally adjusted",I,1990,M01,2025,M12,7,True,44221122,CES4422110001,parent_4digit,CES4422000001,Utilities,CES4422000001,Utilities,CES4000000001,"Trade, transportation, and utilities",CES0700000001,Service-providing,CES0500000001,Total private
462,Natural gas distribution,2212,natural gas distribution,CES4422120001,44,44221200,1,S,"All employees, thousands, natural gas distribution, seasonally adjusted",I,1990,M01,2025,M12,5,True,44221200,CES4422000001,parent_2digit,CES4422000001,Utilities,CES4422000001,Utilities,CES4000000001,"Trade, transportation, and utilities",CES0700000001,Service-providing,CES0500000001,Total private
463,"Water, sewage, and other systems",2213,water sewage and other systems,CES4422130001,44,44221300,1,S,"All employees, thousands, water, sewage, and other systems, seasonally adjusted",I,1990,M01,2025,M12,5,True,44221300,CES4422000001,parent_2digit,CES4422000001,Utilities,CES4422000001,Utilities,CES4000000001,"Trade, transportation, and utilities",CES0700000001,Service-providing,CES0500000001,Total private
464,Information,51,information,CES5000000001,50,50000000,1,S,"All employees, thousands, information, seasonally adjusted",,1939,M01,2026,M01,2,True,50000000,CES0500000001,top_level_to_total_private,CES0700000001,Service-providing,CES0700000001,Service-providing,CES0700000001,Service-providing,CES0700000001,Service-providing,CES0500000001,Total private
465,Motion picture and sound recording industries,512,motion picture and sound recording industries,CES5051200001,50,50512000,1,S,"All employees, thousands, motion picture and sound recording industries, seasonally adjusted",,1990,M01,2026,M01,4,True,50512000,CES0500000001,top_level_to_total_private,CES0700000001,Service-providing,CES0700000001,Service-providing,CES5000000001,Information,CES0700000001,Service-providing,CES0500000001,Total private
466,Motion picture and video production,51211,motion picture and video production,CES5051211001,50,50512110,1,S,"All employees, thousands, motion picture and video production, seasonally adjusted",I,1990,M01,2025,M12,6,True,50512110,CES5051200001,parent_3digit,CES5051200001,Motion picture and sound recording industries,CES0700000001,Service-providing,CES5000000001,Information,CES0700000001,Service-providing,CES0500000001,Total private
467,Motion picture and video exhibition,51213,motion picture and video exhibition,CES5051213001,50,50512130,1,S,"All employees, thousands, motion picture and video exhibition, seasonally adjusted",I,1972,M01,2025,M12,6,True,50512130,CES5051200001,parent_3digit,CES5051200001,Motion picture and sound recording industries,CES0700000001,Service-providing,CES5000000001,Information,CES0700000001,Service-providing,CES0500000001,Total private
468,Publishing industries,513,publishing industries,CES5051300001,50,50513000,1,S,"All employees, thousands, publishing industries, seasonally adjusted",,1990,M01,2026,M01,4,True,50513000,CES0500000001,top_level_to_total_private,CES0700000001,Service-providing,CES0700000001,Service-providing,CES5000000001,Information,CES0700000001,Service-providing,CES0500000001,Total private
469,"Newspaper, periodical, book, and directory publishers",5131,newspaper periodical book and directory publishers,CES5051310001,50,50513100,1,S,"All employees, thousands, newspaper, periodical, book, and directory publishers, seasonally adjusted",I,1990,M01,2025,M12,5,True,50513100,CES5051300001,parent_3digit,CES5051300001,Publishing industries,CES0700000001,Service-providing,CES5000000001,Information,CES0700000001,Service-providing,CES0500000001,Total private
470,Newspaper publishers,51311,newspaper publishers,CES5051311001,50,50513110,1,S,"All employees, thousands, newspaper publishers, seasonally adjusted",I,1990,M01,2025,M12,6,True,50513110,CES5051300001,parent_3digit,CES5051300001,Publishing industries,CES0700000001,Service-providing,CES5000000001,Information,CES0700000001,Service-providing,CES0500000001,Total private
471,Periodical publishers,51312,periodical publishers,CES5051312001,50,50513120,1,S,"All employees, thousands, periodical publishers, seasonally adjusted",I,1990,M01,2025,M12,6,True,50513120,CES5051300001,parent_3digit,CES5051300001,Publishing industries,CES0700000001,Service-providing,CES5000000001,Information,CES0700000001,Service-providing,CES0500000001,Total private
472,Book publishers,51313,book publishers,CES5051313001,50,50513130,1,S,"All employees, thousands, book publishers, seasonally adjusted",I,1990,M01,2025,M12,6,True,50513130,CES5051300001,parent_3digit,CES5051300001,Publishing industries,CES0700000001,Service-providing,CES5000000001,Information,CES0700000001,Service-providing,CES0500000001,Total private
473,"Directory, mailing list, and other publishers","51314,9",directory mailing list and other publishers,CES5051319001,50,50513190,1,S,"All employees, thousands, directory, mailing list, and other publishers, seasonally adjusted",I,1990,M01,2025,M12,6,True,50513190,CES5051300001,parent_3digit,CES5051300001,Publishing industries,CES0700000001,Service-providing,CES5000000001,Information,CES0700000001,Service-providing,CES0500000001,Total private
474,Software publishers,5132,software publishers,CES5051320001,50,50513200,1,S,"All employees, thousands, software publishers, seasonally adjusted",I,1990,M01,2025,M12,5,True,50513200,CES5051300001,parent_3digit,CES5051300001,Publishing industries,CES0700000001,Service-providing,CES5000000001,Information,CES0700000001,Service-providing,CES0500000001,Total private
475,Broadcasting and content providers,516,broadcasting and content providers,CES5051600001,50,50516000,1,S,"All employees, thousands, broadcasting and content providers, seasonally adjusted",,1990,M01,2026,M01,4,True,50516000,CES0500000001,top_level_to_total_private,CES0700000001,Service-providing,CES0700000001,Service-providing,CES5000000001,Information,CES0700000001,Service-providing,CES0500000001,Total private
476,Radio and television broadcasting stations,5161,radio and television broadcasting stations,CES5051610001,50,50516100,1,S,"All employees, thousands, radio and television broadcasting stations, seasonally adjusted",I,1990,M01,2025,M12,5,True,50516100,CES5051600001,parent_3digit,CES5051600001,Broadcasting and content providers,CES0700000001,Service-providing,CES5000000001,Information,CES0700000001,Service-providing,CES0500000001,Total private
477,Radio broadcasting stations,51611,radio broadcasting stations,CES5051611001,50,50516110,1,S,"All employees, thousands, radio broadcasting stations, seasonally adjusted",I,1982,M01,2025,M12,6,True,50516110,CES5051600001,parent_3digit,CES5051600001,Broadcasting and content providers,CES0700000001,Service-providing,CES5000000001,Information,CES0700000001,Service-providing,CES0500000001,Total private
478,Television broadcasting stations,51612,television broadcasting stations,CES5051612001,50,50516120,1,S,"All employees, thousands, television broadcasting stations, seasonally adjusted",I,1982,M01,2025,M12,6,True,50516120,CES5051600001,parent_3digit,CES5051600001,Broadcasting and content providers,CES0700000001,Service-providing,CES5000000001,Information,CES0700000001,Service-providing,CES0500000001,Total private
479,"Media streaming distribution services, social networks, and other media networks and content providers",5162,media streaming distribution services social networks and other media networks and content providers,CES5051620001,50,50516200,1,S,"All employees, thousands, media streaming distribution services, social networks, and other media networks and content providers, seasonally adjusted",I,1990,M01,2025,M12,5,True,50516200,CES5051600001,parent_3digit,CES5051600001,Broadcasting and content providers,CES0700000001,Service-providing,CES5000000001,Information,CES0700000001,Service-providing,CES0500000001,Total private
480,Telecommunications,517,telecommunications,CES5051700001,50,50517000,1,S,"All employees, thousands, telecommunications, seasonally adjusted",,1990,M01,2026,M01,4,True,50517000,CES0500000001,top_level_to_total_private,CES0700000001,Service-providing,CES0700000001,Service-providing,CES5000000001,Information,CES0700000001,Service-providing,CES0500000001,Total private
481,Wired and wireless telecommunications (except satellite),5171,wired and wireless telecommunications except satellite,CES5051710001,50,50517100,1,S,"All employees, thousands, wired and wireless telecommunications (except satellite), seasonally adjusted",I,1990,M01,2025,M12,5,True,50517100,CES5051700001,parent_3digit,CES5051700001,Telecommunications,CES0700000001,Service-providing,CES5000000001,Information,CES0700000001,Service-providing,CES0500000001,Total private
482,Wired and wireless telecommunications carriers (except satellite),51711,wired and wireless telecommunications carriers except satellite,CES5051711001,50,50517110,1,S,"All employees, thousands, wired and wireless telecommunications carriers (except satellite), seasonally adjusted",I,1990,M01,2025,M12,6,True,50517110,CES5051700001,parent_3digit,CES5051700001,Telecommunications,CES0700000001,Service-providing,CES5000000001,Information,CES0700000001,Service-providing,CES0500000001,Total private
483,Wired telecommunications carriers,517111,wired telecommunications carriers,CES5051711101,50,50517111,1,S,"All employees, thousands, wired telecommunications carriers, seasonally adjusted",I,1990,M01,2025,M12,7,True,50517111,CES5051700001,parent_3digit,CES5051700001,Telecommunications,CES0700000001,Service-providing,CES5000000001,Information,CES0700000001,Service-providing,CES0500000001,Total private
484,Wireless telecommunications carriers (except satellite),517112,wireless telecommunications carriers except satellite,CES5051711201,50,50517112,1,S,"All employees, thousands, wireless telecommunications carriers (except satellite), seasonally adjusted",I,1990,M01,2025,M12,7,True,50517112,CES5051700001,parent_3digit,CES5051700001,Telecommunications,CES0700000001,Service-providing,CES5000000001,Information,CES0700000001,Service-providing,CES0500000001,Total private
485,Telecommunications resellers,51712,telecommunications resellers,CES5051712001,50,50517120,1,S,"All employees, thousands, telecommunications resellers, seasonally adjusted",I,1990,M01,2025,M12,6,True,50517120,CES5051700001,parent_3digit,CES5051700001,Telecommunications,CES0700000001,Service-providing,CES5000000001,Information,CES0700000001,Service-providing,CES0500000001,Total private
486,All other telecommunications,"5174,8",all other telecommunications,CES5051780001,50,50517800,1,S,"All employees, thousands, all other telecommunications, seasonally adjusted",I,1990,M01,2025,M12,5,True,50517800,CES5051700001,parent_3digit,CES5051700001,Telecommunications,CES0700000001,Service-providing,CES5000000001,Information,CES0700000001,Service-providing,CES0500000001,Total private
487,"Computing infrastructure providers, data processing, web hosting, and related services",518,computing infrastructure providers data processing web hosting and related services,CES5051800001,50,50518000,1,S,"All employees, thousands, computing infrastructure providers, data processing, web hosting, and related services, seasonally adjusted",,1990,M01,2026,M01,4,True,50518000,CES0500000001,top_level_to_total_private,CES0700000001,Service-providing,CES0700000001,Service-providing,CES5000000001,Information,CES0700000001,Service-providing,CES0500000001,Total private
