row_order,industry_name,naics_code,industry_name_norm,series_id,supersector_code,industry_code,data_type_code,seasonal,series_title,footnote_codes,begin_year,begin_period,end_year,end_period,display_level,matched,industry_code_8,parent_series_id,parent_rule,denominator_opt1,denominator_opt1_name,denominator_opt2,denominator_opt2_name,denominator_opt3,denominator_opt3_name,denominator_opt4,denominator_opt4_name,denominator_opt5,denominator_opt5_name
592,"Research and development in the physical, engineering, and life sciences, except nanotechnology and biotechnology",541715,research and development in the physical engineering and life sciences except nanotechnology and biotechnology,CES6054171501,60,60541715,1,S,"All employees, thousands, research and development in the physical, engineering, and life sciences, except nanotechnology and biotechnology, seasonally adjusted",I,1990,M01,2025,M12,7,True,60541715,CES6054170001,parent_4digit,CES6054000001,"Professional, scientific, and technical services",CES6054000001,"Professional, scientific, and technical services",CES6000000001,Professional and business services,CES0700000001,Service-providing,CES0500000001,Total private
593,Research and development in the social sciences and humanities,54172,research and development in the social sciences and humanities,CES6054172001,60,60541720,1,S,"All employees, thousands, research and development in the social sciences and humanities, seasonally adjusted",I,1990,M01,2025,M12,6,True,60541720,CES6054170001,parent_4digit,CES6054000001,"Professional, scientific, and technical services",CES6054000001,"Professional, scientific, and technical services",CES6000000001,Professional and business services,CES0700000001,Service-providing,CES0500000001,Total private
594,"Advertising, public relations, and related services",5418,advertising public relations and related services,CES6054180001,60,60541800,1,S,"All employees, thousands, advertising, public relations, and related services, seasonally adjusted",,1990,M01,2026,M01,5,True,60541800,CES6054000001,parent_2digit,CES6054000001,"Professional, scientific, and technical services",CES6054000001,"Professional, scientific, and technical services",CES6000000001,Professional and business services,CES0700000001,Service-providing,CES0500000001,Total private
595,Advertising agencies,54181,advertising agencies,CES6054181001,60,60541810,1,S,"All employees, thousands, advertising agencies, seasonally adjusted",I,1990,M01,2025,M12,6,True,60541810,CES6054180001,parent_4digit,CES6054000001,"Professional, scientific, and technical services",CES6054000001,"Professional, scientific, and technical services",CES6000000001,Professional and business services,CES0700000001,Service-providing,CES0500000001,Total private
596,Public relations agencies,54182,public relations agencies,CES6054182001,60,60541820,1,S,"All employees, thousands, public relations agencies, seasonally adjusted",I,1990,M01,2025,M12,6,True,60541820,CES6054180001,parent_4digit,CES6054000001,"Professional, scientific, and technical services",CES6054000001,"Professional, scientific, and technical services",CES6000000001,Professional and business services,CES0700000001,Service-providing,CES0500000001,Total private
597,Media buying agencies and media representatives,"54183,4",media buying agencies and media representatives,CES6054184001,60,60541840,1,S,"All employees, thousands, media buying agencies and media representatives, seasonally adjusted",I,1990,M01,2025,M12,6,True,60541840,CES6054180001,parent_4digit,CES6054000001,"Professional, scientific, and technical services",CES6054000001,"Professional, scientific, and technical services",CES6000000001,Professional and business services,CES0700000001,Service-providing,CES0500000001,Total private
598,Indoor and outdoor display advertising,54185,indoor and outdoor display advertising,CES6054185001,60,60541850,1,S,"All employees, thousands, indoor and outdoor display advertising, seasonally adjusted",I,1990,M01,2025,M12,6,True,60541850,CES6054180001,parent_4digit,CES6054000001,"Professional, scientific, and technical services",CES6054000001,"Professional, scientific, and technical services",CES6000000001,Professional and business services,CES0700000001,Service-providing,CES0500000001,Total private
599,Direct mail advertising,54186,direct mail advertising,CES6054186001,60,60541860,1,S,"All employees, thousands, direct mail advertising, seasonally adjusted",I,1990,M01,2025,M12,6,True,60541860,CES6054180001,parent_4digit,CES6054000001,"Professional, scientific, and technical services",CES6054000001,"Professional, scientific, and technical services",CES6000000001,Professional and business services,CES0700000001,Service-providing,CES0500000001,Total private
600,Advertising material distribution and other services related to advertising,"54187,9",advertising material distribution and other services related to advertising,CES6054189001,60,60541890,1,S,"All employees, thousands, advertising material distribution and other services related to advertising, seasonally adjusted",I,1990,M01,2025,M12,6,True,60541890,CES6054180001,parent_4digit,CES6054000001,"Professional, scientific, and technical services",CES6054000001,"Professional, scientific, and technical services",CES6000000001,Professional and business services,CES0700000001,Service-providing,CES0500000001,Total private
601,"Other professional, scientific, and technical services",5419,other professional scientific and technical services,CES6054190001,60,60541900,1,S,"All employees, thousands, other professional, scientific, and technical services, seasonally adjusted",,1990,M01,2026,M01,5,True,60541900,CES6054000001,parent_2digit,CES6054000001,"Professional, scientific, and technical services",CES6054000001,"Professional, scientific, and technical services",CES6000000001,Professional and business services,CES0700000001,Service-providing,CES0500000001,Total private
602,Marketing research and public opinion polling,54191,marketing research and public opinion polling,CES6054191001,60,60541910,1,S,"All employees, thousands, marketing research and public opinion polling, seasonally adjusted",I,1990,M01,2025,M12,6,True,60541910,CES6054190001,parent_4digit,CES6054000001,"Professional, scientific, and technical services",CES6054000001,"Professional, scientific, and technical services",CES6000000001,Professional and business services,CES0700000001,Service-providing,CES0500000001,Total private
603,Photographic services,54192,photographic services,CES6054192001,60,60541920,1,S,"All employees, thousands, photographic services, seasonally adjusted",I,1990,M01,2025,M12,6,True,60541920,CES6054190001,parent_4digit,CES6054000001,"Professional, scientific, and technical services",CES6054000001,"Professional, scientific, and technical services",CES6000000001,Professional and business services,CES0700000001,Service-providing,CES0500000001,Total private
604,Veterinary services,54194,veterinary services,CES6054194001,60,60541940,1,S,"All employees, thousands, veterinary services, seasonally adjusted",I,1982,M01,2025,M12,6,True,60541940,CES6054190001,parent_4digit,CES6054000001,"Professional, scientific, and technical services",CES6054000001,"Professional, scientific, and technical services",CES6000000001,Professional and business services,CES0700000001,Service-providing,CES0500000001,Total private
605,"Translation, interpretation, and all other professional, scientific, and technical services","54193,9",translation interpretation and all other professional scientific and technical services,CES6054199001,60,60541990,1,S,"All employees, thousands, translation, interpretation, and all other professional, scientific, and technical services, seasonally adjusted",I,1990,M01,2025,M12,6,True,60541990,CES6054190001,parent_4digit,CES6054000001,"Professional, scientific, and technical services",CES6054000001,"Professional, scientific, and technical services",CES6000000001,Professional and business services,CES0700000001,Service-providing,CES0500000001,Total private
606,Management of companies and enterprises,55,management of companies and enterprises,CES6055000001,60,60550000,1,S,"All employees, thousands, management of companies and enterprises, seasonally adjusted",,1990,M01,2026,M01,3,True,60550000,CES0500000001,top_level_to_total_private,CES0700000001,Service-providing,CES0700000001,Service-providing,CES6000000001,Professional and business services,CES0700000001,Service-providing,CES0500000001,Total private
607,Offices of bank and other holding companies,"551111,2",offices of bank and other holding companies,CES6055111201,60,60551112,1,S,"All employees, thousands, offices of bank and other holding companies, seasonally adjusted",I,1990,M01,2025,M12,7,True,60551112,CES6055000001,parent_2digit,CES6055000001,Management of companies and enterprises,CES6055000001,Management of companies and enterprises,CES6000000001,Professional and business services,CES0700000001,Service-providing,CES0500000001,Total private
608,"Corporate, subsidiary, and regional managing offices",551114,corporate subsidiary and regional managing offices,CES6055111401,60,60551114,1,S,"All employees, thousands, corporate, subsidiary, and regional managing offices, seasonally adjusted",I,1990,M01,2025,M12,7,True,60551114,CES6055000001,parent_2digit,CES6055000001,Management of companies and enterprises,CES6055000001,Management of companies and enterprises,CES6000000001,Professional and business services,CES0700000001,Service-providing,CES0500000001,Total private
609,Administrative and support and waste management and remediation services,56,administrative and support and waste management and remediation services,CES6056000001,60,60560000,1,S,"All employees, thousands, administrative and support and waste management and remediation services, seasonally adjusted",,1990,M01,2026,M01,3,True,60560000,CES0500000001,top_level_to_total_private,CES0700000001,Service-providing,CES0700000001,Service-providing,CES6000000001,Professional and business services,CES0700000001,Service-providing,CES0500000001,Total private
610,Administrative and support services,561,administrative and support services,CES6056100001,60,60561000,1,S,"All employees, thousands, administrative and support services, seasonally adjusted",,1990,M01,2026,M01,4,True,60561000,CES0500000001,top_level_to_total_private,CES0700000001,Service-providing,CES6056000001,Administrative and support and waste management and remediation services,CES6000000001,Professional and business services,CES0700000001,Service-providing,CES0500000001,Total private
611,Office administrative services,5611,office administrative services,CES6056110001,60,60561100,1,S,"All employees, thousands, office administrative services, seasonally adjusted",,1990,M01,2026,M01,5,True,60561100,CES6056100001,parent_3digit,CES6056100001,Administrative and support services,CES6056000001,Administrative and support and waste management and remediation services,CES6000000001,Professional and business services,CES0700000001,Service-providing,CES0500000001,Total private
612,Facilities support services,5612,facilities support services,CES6056120001,60,60561200,1,S,"All employees, thousands, facilities support services, seasonally adjusted",,1990,M01,2026,M01,5,True,60561200,CES6056100001,parent_3digit,CES6056100001,Administrative and support services,CES6056000001,Administrative and support and waste management and remediation services,CES6000000001,Professional and business services,CES0700000001,Service-providing,CES0500000001,Total private
613,Employment services,5613,employment services,CES6056130001,60,60561300,1,S,"All employees, thousands, employment services, seasonally adjusted",,1985,M01,2026,M01,5,True,60561300,CES6056100001,parent_3digit,CES6056100001,Administrative and support services,CES6056000001,Administrative and support and waste management and remediation services,CES6000000001,Professional and business services,CES0700000001,Service-providing,CES0500000001,Total private
614,Employment placement agencies and executive search services,56131,employment placement agencies and executive search services,CES6056131001,60,60561310,1,S,"All employees, thousands, employment placement agencies and executive search services, seasonally adjusted",I,1990,M01,2025,M12,6,True,60561310,CES6056100001,parent_3digit,CES6056100001,Administrative and support services,CES6056000001,Administrative and support and waste management and remediation services,CES6000000001,Professional and business services,CES0700000001,Service-providing,CES0500000001,Total private
615,Employment placement agencies,561311,employment placement agencies,CES6056131101,60,60561311,1,S,"All employees, thousands, employment placement agencies, seasonally adjusted",I,1990,M01,2025,M12,7,True,60561311,CES6056100001,parent_3digit,CES6056100001,Administrative and support services,CES6056000001,Administrative and support and waste management and remediation services,CES6000000001,Professional and business services,CES0700000001,Service-providing,CES0500000001,Total private
616,Executive search services,561312,executive search services,CES6056131201,60,60561312,1,S,"All employees, thousands, executive search services, seasonally adjusted",I,1990,M01,2025,M12,7,True,60561312,CES6056100001,parent_3digit,CES6056100001,Administrative and support services,CES6056000001,Administrative and support and waste management and remediation services,CES6000000001,Professional and business services,CES0700000001,Service-providing,CES0500000001,Total private
617,Temporary help services,56132,temporary help services,CES6056132001,60,60561320,1,S,"All employees, thousands, temporary help services, seasonally adjusted",I,1990,M01,2026,M01,6,True,60561320,CES6056100001,parent_3digit,CES6056100001,Administrative and support services,CES6056000001,Administrative and support and waste management and remediation services,CES6000000001,Professional and business services,CES0700000001,Service-providing,CES0500000001,Total private
618,Professional employer organizations,56133,professional employer organizations,CES6056133001,60,60561330,1,S,"All employees, thousands, professional employer organizations, seasonally adjusted",I,1990,M01,2025,M12,6,True,60561330,CES6056100001,parent_3digit,CES6056100001,Administrative and support services,CES6056000001,Administrative and support and waste management and remediation services,CES6000000001,Professional and business services,CES0700000001,Service-providing,CES0500000001,Total private
619,Business support services,5614,business support services,CES6056140001,60,60561400,1,S,"All employees, thousands, business support services, seasonally adjusted",,1990,M01,2026,M01,5,True,60561400,CES6056100001,parent_3digit,CES6056100001,Administrative and support services,CES6056000001,Administrative and support and waste management and remediation services,CES6000000001,Professional and business services,CES0700000001,Service-providing,CES0500000001,Total private
620,Document preparation services,56141,document preparation services,CES6056141001,60,60561410,1,S,"All employees, thousands, document preparation services, seasonally adjusted",I,1990,M01,2025,M12,6,True,60561410,CES6056100001,parent_3digit,CES6056100001,Administrative and support services,CES6056000001,Administrative and support and waste management and remediation services,CES6000000001,Professional and business services,CES0700000001,Service-providing,CES0500000001,Total private
621,Telephone call centers,56142,telephone call centers,CES6056142001,60,60561420,1,S,"All employees, thousands, telephone call centers, seasonally adjusted",I,1990,M01,2025,M12,6,True,60561420,CES6056100001,parent_3digit,CES6056100001,Administrative and support services,CES6056000001,Administrative and support and waste management and remediation services,CES6000000001,Professional and business services,CES0700000001,Service-providing,CES0500000001,Total private
622,Telephone answering services,561421,telephone answering services,CES6056142101,60,60561421,1,S,"All employees, thousands, telephone answering services, seasonally adjusted",I,1990,M01,2025,M12,7,True,60561421,CES6056100001,parent_3digit,CES6056100001,Administrative and support services,CES6056000001,Administrative and support and waste management and remediation services,CES6000000001,Professional and business services,CES0700000001,Service-providing,CES0500000001,Total private
623,Telemarketing bureaus and other contact centers,561422,telemarketing bureaus and other contact centers,CES6056142201,60,60561422,1,S,"All employees, thousands, telemarketing bureaus and other contact centers, seasonally adjusted",I,1990,M01,2025,M12,7,True,60561422,CES6056100001,parent_3digit,CES6056100001,Administrative and support services,CES6056000001,Administrative and support and waste management and remediation services,CES6000000001,Professional and business services,CES0700000001,Service-providing,CES0500000001,Total private
624,Business service centers,56143,business service centers,CES6056143001,60,60561430,1,S,"All employees, thousands, business service centers, seasonally adjusted",I,1990,M01,2025,M12,6,True,60561430,CES6056100001,parent_3digit,CES6056100001,Administrative and support services,CES6056000001,Administrative and support and waste management and remediation services,CES6000000001,Professional and business services,CES0700000001,Service-providing,CES0500000001,Total private
625,Collection agencies,56144,collection agencies,CES6056144001,60,60561440,1,S,"All employees, thousands, collection agencies, seasonally adjusted",I,1990,M01,2025,M12,6,True,60561440,CES6056100001,parent_3digit,CES6056100001,Administrative and support services,CES6056000001,Administrative and support and waste management and remediation services,CES6000000001,Professional and business services,CES0700000001,Service-providing,CES0500000001,Total private
626,"Repossession, court reporting, stenotype, and other business support services and credit bureaus","56145,9",repossession court reporting stenotype and other business support services and credit bureaus,CES6056149001,60,60561490,1,S,"All employees, thousands, repossession, court reporting, stenotype, and other business support services and credit bureaus, seasonally adjusted",I,1990,M01,2025,M12,6,True,60561490,CES6056100001,parent_3digit,CES6056100001,Administrative and support services,CES6056000001,Administrative and support and waste management and remediation services,CES6000000001,Professional and business services,CES0700000001,Service-providing,CES0500000001,Total private
627,All other business support services,561499,all other business support services,CES6056149901,60,60561499,1,S,"All employees, thousands, all other business support services, seasonally adjusted",I,1990,M01,2025,M12,7,True,60561499,CES6056100001,parent_3digit,CES6056100001,Administrative and support services,CES6056000001,Administrative and support and waste management and remediation services,CES6000000001,Professional and business services,CES0700000001,Service-providing,CES0500000001,Total private
628,Travel arrangement and reservation services,5615,travel arrangement and reservation services,CES6056150001,60,60561500,1,S,"All employees, thousands, travel arrangement and reservation services, seasonally adjusted",,1990,M01,2026,M01,5,True,60561500,CES6056100001,parent_3digit,CES6056100001,Administrative and support services,CES6056000001,Administrative and support and waste management and remediation services,CES6000000001,Professional and business services,CES0700000001,Service-providing,CES0500000001,Total private
629,Travel agencies,56151,travel agencies,CES6056151001,60,60561510,1,S,"All employees, thousands, travel agencies, seasonally adjusted",I,1990,M01,2025,M12,6,True,60561510,CES6056100001,parent_3digit,CES6056100001,Administrative and support services,CES6056000001,Administrative and support and waste management and remediation services,CES6000000001,Professional and business services,CES0700000001,Service-providing,CES0500000001,Total private
630,Tour operators,56152,tour operators,CES6056152001,60,60561520,1,S,"All employees, thousands, tour operators, seasonally adjusted",I,1990,M01,2025,M12,6,True,60561520,CES6056100001,parent_3digit,CES6056100001,Administrative and support services,CES6056000001,Administrative and support and waste management and remediation services,CES6000000001,Professional and business services,CES0700000001,Service-providing,CES0500000001,Total private
631,Other travel arrangement and reservation services,56159,other travel arrangement and reservation services,CES6056159001,60,60561590,1,S,"All employees, thousands, other travel arrangement and reservation services, seasonally adjusted",I,1990,M01,2025,M12,6,True,60561590,CES6056100001,parent_3digit,CES6056100001,Administrative and support services,CES6056000001,Administrative and support and waste management and remediation services,CES6000000001,Professional and business services,CES0700000001,Service-providing,CES0500000001,Total private
632,Investigation and security services,5616,investigation and security services,CES6056160001,60,60561600,1,S,"All employees, thousands, investigation and security services, seasonally adjusted",,1990,M01,2026,M01,5,True,60561600,CES6056100001,parent_3digit,CES6056100001,Administrative and support services,CES6056000001,Administrative and support and waste management and remediation services,CES6000000001,Professional and business services,CES0700000001,Service-providing,CES0500000001,Total private
633,"Investigation, guard, and armored car services",56161,investigation guard and armored car services,CES6056161001,60,60561610,1,S,"All employees, thousands, investigation, guard, and armored car services, seasonally adjusted",I,1990,M01,2025,M12,6,True,60561610,CES6056100001,parent_3digit,CES6056100001,Administrative and support services,CES6056000001,Administrative and support and waste management and remediation services,CES6000000001,Professional and business services,CES0700000001,Service-providing,CES0500000001,Total private
634,Investigation and personal background check services,561611,investigation and personal background check services,CES6056161101,60,60561611,1,S,"All employees, thousands, investigation and personal background check services, seasonally adjusted",I,1990,M01,2025,M12,7,True,60561611,CES6056100001,parent_3digit,CES6056100001,Administrative and support services,CES6056000001,Administrative and support and waste management and remediation services,CES6000000001,Professional and business services,CES0700000001,Service-providing,CES0500000001,Total private
635,"Security guards, patrol services, and armored car services","561612,3",security guards patrol services and armored car services,CES6056161301,60,60561613,1,S,"All employees, thousands, security guards, patrol services, and armored car services, seasonally adjusted",I,1990,M01,2025,M12,7,True,60561613,CES6056100001,parent_3digit,CES6056100001,Administrative and support services,CES6056000001,Administrative and support and waste management and remediation services,CES6000000001,Professional and business services,CES0700000001,Service-providing,CES0500000001,Total private
636,Security systems services,56162,security systems services,CES6056162001,60,60561620,1,S,"All employees, thousands, security systems services, seasonally adjusted",I,1990,M01,2025,M12,6,True,60561620,CES6056100001,parent_3digit,CES6056100001,Administrative and support services,CES6056000001,Administrative and support and waste management and remediation services,CES6000000001,Professional and business services,CES0700000001,Service-providing,CES0500000001,Total private
637,Services to buildings and dwellings,5617,services to buildings and dwellings,CES6056170001,60,60561700,1,S,"All employees, thousands, services to buildings and dwellings, seasonally adjusted",,1990,M01,2026,M01,5,True,60561700,CES6056100001,parent_3digit,CES6056100001,Administrative and support services,CES6056000001,Administrative and support and waste management and remediation services,CES6000000001,Professional and business services,CES0700000001,Service-providing,CES0500000001,Total private
638,Exterminating and pest control services,56171,exterminating and pest control services,CES6056171001,60,60561710,1,S,"All employees, thousands, exterminating and pest control services, seasonally adjusted",I,1990,M01,2025,M12,6,True,60561710,CES6056100001,parent_3digit,CES6056100001,Administrative and support services,CES6056000001,Administrative and support and waste management and remediation services,CES6000000001,Professional and business services,CES0700000001,Service-providing,CES0500000001,Total private
639,Janitorial services,56172,janitorial services,CES6056172001,60,60561720,1,S,"All employees, thousands, janitorial services, seasonally adjusted",I,1990,M01,2025,M12,6,True,60561720,CES6056100001,parent_3digit,CES6056100001,Administrative and support services,CES6056000001,Administrative and support and waste management and remediation services,CES6000000001,Professional and business services,CES0700000001,Service-providing,CES0500000001,Total private
640,Landscaping services,56173,landscaping services,CES6056173001,60,60561730,1,S,"All employees, thousands, landscaping services, seasonally adjusted",I,1990,M01,2025,M12,6,True,60561730,CES6056100001,parent_3digit,CES6056100001,Administrative and support services,CES6056000001,Administrative and support and waste management and remediation services,CES6000000001,Professional and business services,CES0700000001,Service-providing,CES0500000001,Total private
